id,title,url,rate,Tag1,Tag2,Tag3,Tag4,Tag5,difficulty,steps,budget,people,prep_time,cooking_time,total_time,images
3028,Pesto (ou Pistou),https://www.marmiton.org/recettes/recette_pesto-ou-pistou_80119.aspx,4.7,sauce salée,pesto,,,,très facile,"[""Dans le bol du mixeur, mettre les feuilles de basilic, l'ail préalablement émincé en fins copeaux, les pignons, le sel et le poivre. Bien mixer."", ""Puis ajouter le parmesan et l'huile petit à petit en continuant à mixer.""]",moyen,4,10,0,10,"['https://assets.afcdn.com/recipe/20230713/144164_w314h314c1cx2880cy1920cxt0cyt0cxb5760cyb3840.webp', 'https://assets.afcdn.com/recipe/20180327/78190_w314h314c1cx2592cy1728cxt0cyt0cxb5184cyb3456.webp', 'https://assets.afcdn.com/recipe/20100120/51424_w314h314c1cx256cy192.webp']"
3029,Caramel liquide,https://www.marmiton.org/recettes/recette_caramel-liquide_24324.aspx,4.0,dessert,sauce sucrée,caramel,,,facile,"[""Dans une casserole à fond épais, humecter les morceaux de sucre avec 4-5 cuillères à soupe d'eau."", 'Faire fondre le sucre à feu doux. Incliner la casserole de temps en temps mais ne surtout pas mélanger.', 'Ajouter 1 trait de jus de citron.', ""Quand le caramel commence à prendre une couleur ambrée, le retirer du feu et verser aussitôt l'eau chaude. Remuer et remettre un peu sur le feu si nécessaire pour bien délayer le caramel."", ""Ce caramel liquide s'utilise pour napper les îles flottantes, les coupes de glaces et autres desserts.""]",moyen,4,10,5,15,"['https://assets.afcdn.com/recipe/20181017/82810_w314h314c1cx1637cy2182cxt0cyt0cxb3274cyb4365.webp', 'https://assets.afcdn.com/recipe/20131106/14098_w314h314c1cx1875cy1250.webp']"
3030,Vinaigrette à l'avocat,https://www.marmiton.org/recettes/recette_vinaigrette-a-l-avocat_46561.aspx,5.0,sauce salée,vinaigrette,,,,très facile,"['Diluer le sel dans 3 cuillères à soupe de vinaigre, ajouter 1 cuillère à soupe de moutarde et mélanger.', ""Couper l'avocat bien mûr et l'écraser dans le mélange moutarde-vinaigre. Rajouter 1 échalote hachée et compléter avec 5 cuillères à soupe d'huile d'olive."", ""Réajuster à votre goût en rajoutant du vinaigre ou de l'huile, vous pouvez aussi rajouter un peu d'eau.""]",moyen,4,5,0,5,"['https://assets.afcdn.com/recipe/20160425/63574_w314h314c1cx3000cy2000.webp', 'https://assets.afcdn.com/recipe/20160425/63573_w314h314c1cx2000cy3000.webp', 'https://assets.afcdn.com/recipe/20140109/66500_w314h314c1cx162cy162.webp']"
3031,Comme une béchamel sans beurre ni lait pas chère du tout,https://www.marmiton.org/recettes/recette_bechamel-sans-beurre-ni-lait_221510.aspx,3.5,sauce salée,béchamel,,,,facile,"[""Mettre à chauffer le litre d'eau."", 'A ébullition, faire dissoudre les deux bouillons cubes.', ""Pendant ce temps, hors du feu, mettre la farine et les 2 cuillères d'eau froide dans une casserole."", 'Mélanger délicatement au fouet à main. Il ne doit pas y avoir de grumeaux.', 'Faire chauffer à petit feu et verser progressivement le bouillon.', 'Saler légèrement.', ""Ne pas cesser de mélanger au fouet à main, jusqu'à obtention d'une belle béchamel.""]",bon marché,4,5,25,30,['https://static.afcdn.com/relmrtn/lazyload.png']
3032,Pesto de coriandre,https://www.marmiton.org/recettes/recette_pesto-de-coriandre_308726.aspx,4.8,sauce salée,pesto,,,,facile,"[""Mettre les ingrédients secs dans le bol d'un mixeur et mixer quelques secondes."", ""Puis, installé dans le mixeur l'ustensile pour remuer et ajouter petit à petit l'huile d'olive (comme pour faire une mayonnaise)."", 'Cette sauce se conserve très bien au réfrigérateur et accompagnera poissons, légumes et viandes.']",bon marché,4,10,0,10,['https://static.afcdn.com/relmrtn/lazyload.png']
3033,sauce tomate au basilic,https://www.marmiton.org/recettes/recette_sauce-tomate-au-basilic_72651.aspx,4.5,sauce salée,Autres sauces,,,,très facile,"[""Râper vos tomates bien mûres: la peau ne vient pas donc c'est un gain de temps."", 'Mettre dans une casserole la tomate et un morceau de sucre et faire cuire 1 h pour épaissir.', ""Dans une autre casserole, mettre l'huile d'olive et faire fondre un oignon puis rajouter la sauce."", ""Mixer ensemble ail, basilic, huile d'olive et rajouter à votre préparation. Saler et poivrer."", 'Laisser mijoter encore 1 h à petit feu.', ""Se déguste bien froide avec un papeton d'aubergines ou courgettes.""]",bon marché,4,10,2,12,['https://static.afcdn.com/relmrtn/lazyload.png']
3034,Bouillon de volaille tout simple,https://www.marmiton.org/recettes/recette_bouillon-de-volaille-tout-simple_57339.aspx,4.9,,,,,,facile,"['Préchauffer le four à 210°C (thermostat 7).', 'Concasser grossièrement les carcasses, les mettre dans un plat et enfourner 15 min.', 'Laver, éplucher, hacher les légumes.', ""Dans une grande marmite (à fond épais de préférence), verser l'huile et faire revenir les abattis, les légumes et les carcasses à feu vif 10 min en remuant."", 'Déglacer en versant le vin blanc.', 'Laisser évaporer quelques minutes.', ""Ajouter 3 l d'eau, le bouquet garni, quelques pincées de sel et une vintaine de grains de poivre."", 'Baisser le feu et laisser mijoter 2 bonnes heures en écumant la mousse en surface de temps en temps.', 'Passer au chinois puis mettre le fond au frigo quelques heures.', 'Retirer ensuite la pellicule de gras formée en surface.']",bon marché,4,35,2,37,['https://static.afcdn.com/relmrtn/lazyload.png']
3035,Boeuf sauce gombo façon Yorouba (Nigeria),https://www.marmiton.org/recettes/recette_boeuf-sauce-gombo-facon-yorouba-nigeria_57292.aspx,4.5,sauce salée,Autres sauces,,,,moyenne,"[""Faire bouillir la viande (de préférence dans une marmite à vapeur c'est plus rapide) avec du sel du poivre et de la poudre de gingembre puis réserver."", 'Faire revenir les crevettes dans une poêle avec juste un peu de sel puis réserver.', ""Mixer 1 gros oignon, la boîte de tomate et les 2 gousses d'ail ensemble puis faire griller le tout dans une poêle profonde avec assez d'huile."", ""Bien remuer jusqu'à ce que la sauce tomate commence à s'épaissir, cela doit devenir un peut pâteux."", ""Ajouté du sel, du poivre et de la poudre de gingembre puis ajouter l'eau de la viande et le piment (option)."", 'Laisser cuire environ 10 minutes en remuant régulièrement puis ajouter la viande et retirer du feu.', ""Couper tout le gombo en tout petit morceau (ne pas mixer, ça noirçi le gombo), le mettre dans une casserole avec un petit oignon émincé et le recouvrir à peine avec de l'eau."", 'Le cuire en remuant sans cesse avec un fouet.', ""Bien remuer le gombo afin qu'il soit assez gluant."", 'Vers la fin de la cuisson (15 minutes), saler et ajouter les crevettes.', ""C'est prêt."", 'Bon appétit.']",moyen,4,45,1,46,['https://static.afcdn.com/relmrtn/lazyload.png']
3036,Sauce à la crème et moutarde,https://www.marmiton.org/recettes/recette_sauce-a-la-creme-et-moutarde_64563.aspx,4.8,sauce salée,sauces à la crème,,,,très facile,"['Verser les deux crèmes dans une casserole sur feu doux.', 'Ajouter la moutarde et bien mélanger au fouet à main, puis verser le jus de citron tout en continuant à fouetter le mélange.', 'Poivrer et saler à votre convenance.', 'Faire cuire à feu très doux et à couvert pendant 15 min.']",bon marché,4,5,15,20,['https://static.afcdn.com/relmrtn/lazyload.png']
3037,Vinaigrette au citron,https://www.marmiton.org/recettes/recette_vinaigrette-au-citron_50349.aspx,4.5,sauce salée,vinaigrette,,,,très facile,"['Dans un bol, mettre la moutarde, le sel et quelques tours de moulin du mélange des cinq baies.', 'Remuer puis ajouter le jus de citron en émulsionnant le mélange.', ""Incorporer l'huile d'olive en un mince filet en remuant vigoureusement afin d'obtenir une vinaigrette bien homogène.""]",bon marché,4,3,0,3,['https://static.afcdn.com/relmrtn/lazyload.png']
3038,Sauce au vin,https://www.marmiton.org/recettes/recette_sauce-au-vin_313856.aspx,4.0,sauce salée,Autres sauces,,,,facile,"['Dans une casserole bien chaude (feu vif), faire revenir l’échalote hachée finement dans le beurre fondu pendant deux ou trois minutes.', 'Quand l’échalote commence à dorer, déglacer avec le Porto.', 'Saler, poivrer.', 'Ajouter le vin et laissez mijoter à feu moyen pendant une dizaine de minutes.', ""Délayer la maïzena dans un peu d'eau. L'ajouter petit à petit en laissant mijoter un peu entre chaque ajout jusqu'à ce que la sauce épaississe un peu."", 'Servir chaud en saucière ou directement sur la viande en assiette dressée.']",bon marché,4,5,15,20,[]
3039,Caramel au beurre salé au Thermomix,https://www.marmiton.org/recettes/recette_caramel-au-beurre-sale-au-thermomix_375133.aspx,1.0,,,,,,très facile,"['Insérer le fouet dans le bol du robot. Ajouter le sucre et le beurre salé. Faire cuire 5 min / 60°C / vitesse 2.', 'Ajouter la crème fleurette et programmer 50 min / 100°C / vitesse 1 avec le couvercle sans le gobelet. Surveiller attentivement.', 'Conserver au réfrigérateur.']",bon marché,4,5,1,6,['https://static.afcdn.com/relmrtn/lazyload.png']
3040,Sauce au beurre blanc pour poisson au Thermomix,https://www.marmiton.org/recettes/recette_sauce-au-beurre-blanc-pour-poisson-au-thermomix_383002.aspx,0.0,sauce salée,Autres sauces,,,,très facile,"['Émincez finement les\xa0échalotes au couteau.', 'Versez dans la cuve de votre Thermomix puis ajoutez le vin et le citron. Lancez la cuisson pendant 5 min / 100°C / vit. 1.', 'Stoppez la cuisson et ajoutez le beurre en morceaux. Laissez fondre sans cuire et mélangez pendant 1 min / 0 °C / vit. 3.', 'Au moment de servir, délayez la crème fraîche dans la préparation.']",bon marché,4,10,0,10,['https://static.afcdn.com/relmrtn/lazyload.png']
3041,Sauce pitta pour kebab,https://www.marmiton.org/recettes/recette_sauce-pitta-pour-kebab_37574.aspx,3.3,sauce salée,Autres sauces,,,,très facile,"['Dans un bol, mélanger tous les ingrédients à la crème fraîche.', 'Pour que la sauce ait plus de goût, laissez-la reposer 30 min au réfrigérateur, surtout si vous utilisez des herbes sèches.']",bon marché,4,5,0,5,[]
3042,Sauce blanche pour pomme de terre en papillotes,https://www.marmiton.org/recettes/recette_sauce-blanche-pour-pomme-de-terre-en-papillotes_39639.aspx,4.7,sauce salée,Autres sauces,,,,très facile,"[""Émincer le plus finement possible l'oignon, l'ail, le persil et la ciboulette."", ""Dans un saladier, fouetter la crème fraiche à la fourchette, y ajouter l'oignon, l'ail, le persil et la ciboulette."", 'Saler et poivrer selon votre goût.', 'Ouvrir une pomme de terre cuite au four en deux, et mettez-y une bonne cuillère de sauce : un vrai régal !']",bon marché,4,20,0,20,['https://static.afcdn.com/relmrtn/lazyload.png']
3043,Sauce tomate au Thermomix,https://www.marmiton.org/recettes/recette_sauce-tomate-au-thermomix_382953.aspx,0.0,sauce salée,coulis de légumes,,,,facile,"['Pelez et coupez l’oignon dans votre Thermomix pendant 15 sec / 0°C / vit. 7.', 'Faites-le dorer dans la cuve de votre robot avec l’huile d’olive pendant 2 min / 100 °C / vit. 1.', 'Ajoutez les tomates coupées en gros morceaux, le concentré, l’ail juste pelé, les herbes, le cube émietté, les feuilles de laurier et le sucre. Salez, poivrez et lancez la cuisson pendant 35 min / 100 °C / vit. 1.', 'Retirez les feuilles de laurier et mixez finement pendant 30 sec / 0 °C / vit. 10.']",bon marché,4,10,35,45,['https://static.afcdn.com/relmrtn/lazyload.png']
3044,Sauce aux airelles,https://www.marmiton.org/recettes/recette_sauce-aux-airelles_105709.aspx,4.9,sauce salée,Autres sauces,,,,très facile,"[""- Hacher finement les échalotes et les faire cuire dans de l'huile d'olive avec les airelles à feu doux ;"", ""- Rajouter le sucre et un verre d'eau, laisser réduire toujours à feu doux ;"", '- Quand le mélange devient sirupeux, ajouter le porto, le sel et le poivre et laisser épaissir 5-10 min ;', '- Ajouter le beurre et retirer du feu ;', '- Monter au fouet et servir aussitôt sur un pavé de biche, une dinde...']",moyen,4,30,30,60,['https://static.afcdn.com/relmrtn/lazyload.png']
3045,Sauce Diable Maledette,https://www.marmiton.org/recettes/recette_sauce-diable-maledette_46454.aspx,0.0,sauce salée,Autres sauces,,,,très facile,"['Faire fondre les échalotes émincées dans 30 gr de beurre, pendant 3 minutes.', 'Verser dessus le vinaigre et le vin blanc, porter à ébullition, et laisser encore cuire 3 min.', 'Ajouter alors le concentré de tomate et le bouillon de volaille, assaisonner, sel, poivre, sucre et Cayenne, porter à ébulition et laisser cuire 5 min.', 'Hors du feu, fouetter dans la sauce, 50 gr de beurre divisé en noisettes.', 'Passer la sauce au chinois, et servir en saucière.']",bon marché,4,15,15,30,[]
3046,Sauce aux cacahuètes,https://www.marmiton.org/recettes/recette_sauce-aux-cacahuetes_20877.aspx,0.0,sauce salée,Autres sauces,,,,facile,"[""Hacher finement les piments, le poivron, les oignons, les échalotes et l'ail. Broyer les cacahuètes, la coriandre et le laurier."", 'Râper le gingembre.', ""Ecraser le tout à l'aide d'un mortier en ajoutant la pâte de crevette et le curcuma."", ""Lorsque l'ensemble est réduit à l'état de pâte, faire chauffer dans l'huile chaude pendant 2 minutes pour exhaler le parfum des épices."", ""Verser le lait de coco, porter à ébullition et laisser épaissir sur feu moyen jusqu'à ce que la sauce nappe la cuillère."", 'A servir avec des légumes ou de la volaille.']",moyen,4,10,20,30,[]
3047,Sauce tomate au Cookeo,https://www.marmiton.org/recettes/recette_sauce-tomate-au-cookeo_382949.aspx,5.0,sauce salée,coulis de légumes,,,,facile,"['Pelez et coupez l’oignon au couteau sur une planche puis versez dans la cuve de votre Cookeo.', 'Faites-le dorer dans la cuve avec l’huile d’olive sur le mode « dorer »  / 2 min préchauffage inclus en remuant constamment.', 'Ajoutez les tomates coupées en gros morceaux, le concentré, l’ail juste pelé, les herbes, le cube émietté, les feuilles de laurier et le sucre. Salez, poivrez et lancez la cuisson sur le mode « cuisson sous pression » / 18 min.', 'Retirez les feuilles de laurier et mixez finement au blender ou  au mixeur plongeur en veillant à ne pas rayer la cuve.']",bon marché,4,10,18,28,['https://static.afcdn.com/relmrtn/lazyload.png']
3048,Béchamel ultra light,https://www.marmiton.org/recettes/recette_bechamel-ultra-light_21457.aspx,4.5,sauce salée,béchamel,,,,très facile,"[""Délayer la Maîzena dans le lait et faire chauffer à feu doux, jusqu'à obtenir une consistance crémeuse."", ""C'est prêt pour alléger vos gratins, épinards et autres plats !""]",bon marché,4,2,5,7,"['https://assets.afcdn.com/recipe/20171103/74275_w314h314c1cx1809cy2709cxt0cyt0cxb3618cyb5418.webp', 'https://assets.afcdn.com/recipe/20221013/136155_w314h314c1cx3072cy1728cxt0cyt0cxb6144cyb3456.webp', 'https://assets.afcdn.com/recipe/20200217/107736_w314h314c1cx2016cy1512cxt0cyt0cxb4032cyb3024.webp']"
3049,Beurre à l'Ail,https://www.marmiton.org/recettes/recette_beurre-a-l-ail_31633.aspx,5.0,,,,,,très facile,"[""Mélanger tout ça, et surtout, bien saler ! (l'ail doit être passé au presse-ail avant d'être mélangé, et c'est le contenu de la cuillère de moutarde qu'il faut mélanger!)."", ""En accompagnement d'une grillade, c'est parfait !""]",bon marché,4,10,0,10,['https://static.afcdn.com/relmrtn/lazyload.png']
3050,Sauce au porto,https://www.marmiton.org/recettes/recette_sauce-au-porto_16440.aspx,4.0,sauce salée,Autres sauces,,,,moyenne,"['Faire réduire le porto de moitié. Ajouter la moutarde.', 'Incorporer le beurre progressivement, en petits morceaux.', 'Servir aussitôt.']",moyen,4,15,15,30,[]
3051,Vinaigrette pour asperges à la tomate et à la coriandre,https://www.marmiton.org/recettes/recette_vinaigrette-pour-asperges-a-la-tomate-et-a-la-coriandre_89939.aspx,4.5,sauce salée,vinaigrette,,,,très facile,"[""Couper la tomate en brunoise (ôter l'intérieur et couper la chair en petits dés)."", ""Émincer l'échalote."", 'Effeuiller la coriandre.', ""Mélanger le tout à la cuillère : incorporer l'huile d'olive, le vinaigre balsamique et assaisonner de sel et de poivre.""]",bon marché,4,20,0,20,['https://static.afcdn.com/relmrtn/lazyload.png']
3052,Vinaigrette (au yaourt ou fromage blanc),https://www.marmiton.org/recettes/recette_vinaigrette-au-yaourt-ou-fromage-blanc_29357.aspx,4.7,sauce salée,vinaigrette,,,,très facile,"['Mettre tout les ingrédients dans le saladier et fouetter énergiquement.', 'Poser la salade dessus et mélanger !', 'On peut ajouter des dés de fromages fermes ou semi-fermes.']",bon marché,4,5,0,5,['https://static.afcdn.com/relmrtn/lazyload.png']
3053,Sauce au vin blanc,https://www.marmiton.org/recettes/recette_sauce-au-vin-blanc_12677.aspx,4.7,sauce salée,Autres sauces,,,,facile,"[""Faire fondre le beurre à feu vif dans une poêle à fond épais. Y faire revenir l'échalote environ 2 minutes."", 'Ajouter le vin blanc et faire réduire au tiers, puis ajouter la crème en remuant.']",bon marché,4,5,15,20,['https://static.afcdn.com/relmrtn/lazyload.png']
3054,Pesto de pistache,https://www.marmiton.org/recettes/recette_pesto-de-pistache_38798.aspx,4.2,sauce salée,pesto,,,,très facile,"['Ecraser les grains de poivre blanc au mortier.', 'Vous pouvez faire de même avec les pistaches mais il faut avoir le temps. Pour ma part, je passe le tout au mixer.', ""Ensuite, rajouter le poivre moulu, ainsi que l'hule d'olive, puis mixer à nouveau."", 'Vous obtenez une belle pâte verte avec des morceaux de pistaches encore assez gros.', 'Excellentissime avec des rigatoni (sorte de pâtes) al dente!']",moyen,4,5,0,5,['https://static.afcdn.com/relmrtn/lazyload.png']
3055,Vinaigrette allégée,https://www.marmiton.org/recettes/recette_vinaigrette-allegee_15936.aspx,4.5,sauce salée,vinaigrette,,,,très facile,"[""Délayer la maïzéna à froid avec les 750 ml d'eau, le sel et le poivre."", ""Mettre le tout dans une casserole et faire chauffer à feu doux, tout en remuant jusqu'à épaississement de la préparation."", 'Lorsque le mélange est bien épaissi (environ 10 mn), retirer du feu et laisser refroidir en remuant de temps en temps.', ""Dans un saladier, mélanger le vinaigre avec la moutarde puis incorporer petit à petit l'huile."", 'Ajouter cette 2ème préparation à la 1ère.', 'Mettre le tout dans une bouteille vide ou un shaker. Garder au réfrigérateur.', 'Se conserve 3 semaines.']",bon marché,4,15,10,25,['https://static.afcdn.com/relmrtn/lazyload.png']
3056,Sauce au camembert facile,https://www.marmiton.org/recettes/recette_sauce-au-camembert-facile_59347.aspx,3.9,sauce salée,Autres sauces,,,,très facile,"['Coupez le camembert en petits morceaux, les faire fondre avec le lait sur feu doux en remuant de temps en temps. Dès que le camembert est fondu, ajouter la crème fraîche et le poivre.', 'Parfait avec des pâtes !']",bon marché,4,3,10,13,['https://static.afcdn.com/relmrtn/lazyload.png']
3057,Piment la pâte de la Réunion,https://www.marmiton.org/recettes/recette_piment-la-pate-de-la-reunion_219837.aspx,4.8,,,,,,facile,"['Laver les piments et les couper en morceaux avec les pépins.', 'Peler le gingembre et le couper en morceaux.', ""Peler l'ail et le couper en morceaux."", ""Mettre le tout dans un récipient avec une dizaine de cuillerées à soupe d'huile et 2 cuillères à soupe de vinaigre de vin, du sel."", ""Mixer le tout jusqu'à ce que l'obtention d'une purée. Saler selon le goût."", ""Râper finement la peau du combava et l'ajouter à la purée. Bien mélanger le tout."", ""Mettre dans de petits pots en verre avec de l'huile par dessus pour la conservation, mais sans mélanger."", 'La préparation se conserve plusieurs mois au réfrigérateur.']",bon marché,4,10,0,10,['https://static.afcdn.com/relmrtn/lazyload.png']
3058,SAUCE AU VIN BLANC,https://www.marmiton.org/recettes/recette_sauce-au-vin-blanc_17738.aspx,4.2,sauce salée,Autres sauces,,,,facile,"[""Faire revenir dans une casserole (en fonte de préférence) l'échalote émincée et le beurre à feu doux 5 à 10 mn. Saler, poivre. Ajouter le vin blanc et laisser mijoter 10 à 15 mn à feu très doux."", 'Une fois réduit, ajouter la crème fraîche et une pincée de paprika. Remuez une minute et servez.']",bon marché,4,15,20,35,['https://static.afcdn.com/relmrtn/lazyload.png']
3059,Coulis au chocolat,https://www.marmiton.org/recettes/recette_coulis-au-chocolat_23467.aspx,5.0,dessert,sauce sucrée,coulis au chocolat,,,facile,"['Faites fondre le chocolat cassé en morceaux dans le lait à feu doux. Ajoutez le café en poudre, portez juste à ébullition et retirez du feu.', 'Incorporez le beurre froid coupé en morceaux en fouettant.', 'Ce coulis est parfait pour les profiterolles, les gâteaux natures, les crêpes ou les gaufres.']",moyen,4,5,5,10,['https://static.afcdn.com/relmrtn/lazyload.png']
3060,Béchamel sans gluten et sans lactose,https://www.marmiton.org/recettes/recette_bechamel-sans-gluten-et-sans-lactose_225930.aspx,4.8,sauce salée,béchamel,,,,facile,"[""Dans une casserole, commencez par mélanger la margarine et la maïzena à feu doux jusqu'à l'obtention d'un roux bien homogène."", ""Ajoutez ensuite progressivement le mélange eau+lait, sur feu plus fort. Émiettez le bouillon de légumes et continuez à mélanger au fouet sans vous arrêter, jusqu'à ce que la sauce épaississe."", ""En dehors du feu, ajoutez poivre et muscade. Goutez et rectifiez l'assaisonnement. Ne salez que si nécessaire, le bouillon étant déjà très salé.""]",bon marché,4,10,15,25,['https://static.afcdn.com/relmrtn/lazyload.png']
3061,sauce à la crème de courgettes,https://www.marmiton.org/recettes/recette_sauce-a-la-creme-de-courgettes_37781.aspx,4.6,sauce salée,sauces à la crème,,,,très facile,"[""Otez les grains des courgettes et prélever à l'aide d'un économe de longs rubans de pulpe de courgettes."", ""Les faire cuire dans une sauteuse pendant 25 min à feu doux dans un peu d'huile."", ""Au bout de 25 min, ajoutez l'oignon, la gousse d'ail et le persil hâchés, salez, poivrez. Mélangez."", 'Laissez cuire encore 5 min à couvert.', 'Mixez en purée la préparation de courgettes.', ""Ajoutez le cube bouillon de volaille plus 20 cl d'eau. Laissez mijoter sur feu très doux pendant 10 min."", 'Battre les oeufs en ommelette. Ajoutez hors du feu dans la purée de courgette les oeufs battus et le gruyère. Mélangez.', 'La sauce à la crème de courgettes est prête à être dégustée avec des pâtes ou autre.']",bon marché,4,40,30,70,['https://static.afcdn.com/relmrtn/lazyload.png']
3062,Crème aux poivrons,https://www.marmiton.org/recettes/recette_sauce-creme-aux-poivrons_221456.aspx,4.8,,,,,,facile,"[""Couper en dés les poivrons, l'oignon et l'échalote."", 'Dans une casserole, mettre le beurre, faire revenir les poivrons quelques minutes, ajouter les oignons, les échalotes, le thym et le laurier, saler et poivrer.', 'Mélanger, laisser revenir 1 à 2 minutes puis ajouter le paprika, le curry, mélanger bien.', 'Verser le vin blanc, laisser réduire de moitié, ensuite ajouter la crème fraîche mélanger puis ajouter le paprika et/ou le curry selon le goût et laisser mijoter 5 à 10 minutes à feu doux puis servir.']",bon marché,4,10,15,25,['https://static.afcdn.com/relmrtn/lazyload.png']
3063,Chermoula,https://www.marmiton.org/recettes/recette_chermoula_392437.aspx,5.0,sauce salée,,,,,facile,"['Peler et écraser les gousses d’ail. Réserver.', 'Passer sous l’eau froide les bouquets de coriandre et de persil. \u2028Les hacher finement.', 'Dans un petit récipient, mettre les herbes aromatiques avec les épices et l’ail. Bien mélanger.', 'Verser le jus de citron et l’huile d’olive. Piler le tout et rectifier l’assaisonnement si nécessaire.']",bon marché,4,10,0,10,['https://static.afcdn.com/relmrtn/lazyload.png']
3064,Sauce basilic,https://www.marmiton.org/recettes/recette_sauce-basilic_39701.aspx,4.4,sauce salée,Autres sauces,,,,très facile,"[""Mixer le basilic et l'ail."", ""Ajouter le jaune d'oeuf, et monter une mayonnaise à la fourchette, en alternant huile et huile d'olive, jusqu'à obtenir une mayonnaise assez compacte.""]",bon marché,4,15,0,15,['https://static.afcdn.com/relmrtn/lazyload.png']
3065,Caramel crémeux,https://www.marmiton.org/recettes/recette_caramel-cremeux_38865.aspx,4.4,dessert,sauce sucrée,caramel,,,facile,"['Faire fondre le beurre sur feu doux dans une casserole.', 'Ajouter rapidement le sucre.', 'Dès que le mélange se colore, arrêter le feu.', 'Y incorporer la crème fraîche petit à petit en mélangant bien.', 'Attention, le contraste chaud/froid provoque une forte ébullition.']",bon marché,4,10,7,17,['https://static.afcdn.com/relmrtn/lazyload.png']
3066,Sauce crudités comme au resto chinois,https://www.marmiton.org/recettes/recette_sauce-crudites-comme-au-resto-chinois_49361.aspx,4.8,sauce salée,Autres sauces,,,,très facile,"[""Mélanger tous les ingrédients, sauf l'huile."", ""Ajouter ensuite l'huile, petit à petit, tout en fouettant."", ""Voilà, c'est prêt.""]",bon marché,4,2,0,2,['https://static.afcdn.com/relmrtn/lazyload.png']
3067,Sauce crémeuse à l'ail pour pâtes,https://www.marmiton.org/recettes/recette_sauce-cremeuse-a-l-ail-pour-pates_12409.aspx,4.2,sauce salée,sauces à la crème,,,,très facile,"[""Eplucher et couper les gousses d'ail en tout petits morceaux, les faire revenir doucement à la poèle pendant 15 mn, déglacer, ajouter la crème."", ""On peut ajouter quelques éléments comme un peu de vin blanc ou faire flamber l'ail au cognac avant de mettre la crème.""]",bon marché,4,40,30,70,['https://static.afcdn.com/relmrtn/lazyload.png']
